timestamp,text
0:20,Transcript
0:26,"Hey there, sunshine seekers! Ready to explore  Miami like a local? In this 3-day itinerary,  "
0:31,"we’re hitting Miami’s iconic spots, hidden gems,  and can’t-miss eats—all packed with insider tips  "
0:37,"to make your trip unforgettable. From colorful  art murals to Cuban flavors and sunset views,  "
0:45,I’ve got the ultimate guide lined  up for you. Stick around till the  
0:53,end for pro tips that’ll have you living  like a true Miami insider. Let’s dive in!
0:57,Best Time to Visit Miami The ideal time to visit Miami  
1:00,"is between November and May when  the weather is warm and inviting,  "
1:06,with low humidity and fewer rain showers. Avoid  the peak hurricane season from June to November  
1:11,to enjoy clear skies and calm waters.  Events like Art Basel in December and  
1:17,"the Miami Music Week in March add a cultural  punch, making the city even more electric."
1:19,Miami Airport Tips 
1:25,"Miami International Airport (MIA) is a major hub  and well-connected to the city. Upon arrival,  "
1:30,skip the hassle of waiting in line by booking a  ride through rideshare apps. The Miami Metrorail  
1:37,"costs around $2.25 USD and provides a quick,  affordable option for reaching central locations.  "
1:43,"For first-timers, downloading the MIA Airport  App can make navigating the terminals a breeze!"
1:46,"Where to Stay in Miami For an unforgettable stay,  "
1:51,consider South Beach if you want to be near  the action. Known for its vibrant nightlife  
1:56,"and iconic Ocean Drive, South Beach offers a  range of accommodations, from budget-friendly  "
2:01,hostels to luxury hotels. Wynwood and Downtown  Miami are also excellent choices if you’re  
2:07,"looking for trendy neighborhoods with a mix  of art, culture, and exciting nightlife."
2:10,"Getting Around Miami Miami's public transport network,  "
2:16,"the Miami-Dade Transit, includes the Metrorail,  buses, and the Metromover, which operates within  "
2:23,"Downtown and is free to use. For visitors, the Go  Miami Pass ($75 USD) provides unlimited access to  "
2:29,"several transportation options and discounts at  popular attractions. Alternatively, rental bikes  "
2:34,and rideshare options are widely available for  those who prefer to explore on their own schedule.
2:40,Day 1: Iconic South Beach and Art Deco Wonders Breakfast: Bacon Bitch 
2:45,Kickstart your Miami adventure at Bacon  Bitch on South Beach. Known for its lively  
2:50,"atmosphere and hearty breakfast sandwiches  packed with crispy bacon, eggs, and cheese,  "
2:56,"this spot offers a unique, indulgent start to your  day in Miami. Each bite is loaded with flavor,  "
3:02,with prices around $15-$20 USD per person. Insider Tip: Try pairing your breakfast with their  
3:07,"signature cold brew for an extra morning boost,  and if you’re in the mood for something sweet,  "
3:10,their Nutella French toast is a local favorite . 
3:14,Morning : Explore the Art Deco  Historic District in South Beach 
3:19,"Begin your morning by exploring the Art Deco  Historic District, an iconic Miami landmark filled  "
3:26,"with colorful, retro-style buildings along Ocean  Drive. The district’s pastel facades, neon signs,  "
3:32,"and classic 1930s architecture capture Miami’s  glamorous, nostalgic charm, making it a must-visit  "
3:38,"location. Take a guided tour (around $30 USD),  which dives into the stories behind these  "
3:45,"beautiful structures and the city’s vibrant past. Insider Tip: To avoid the midday heat and crowds,  "
3:49,start your tour early and bring a water  bottle. Many buildings have beautiful  
3:55,"lobbies open to the public, so don’t hesitate  to step inside and admire the vintage decor!"
4:00,Miami Beach Architectural District Dive deeper into Miami’s unique architecture  
4:05,"with a visit to the Miami Beach Architectural  District. Covering a larger area of South Beach,  "
4:09,"this district lets you see a range of  stunning buildings and their intricate,  "
4:13,"streamlined designs. Snap photos  along Collins Avenue, where you’ll  "
4:18,"find some of Miami’s most famous Art Deco  hotels, like The Delano and The Raleigh."
4:23,Insider Tip: Head to the rooftop bar at  The Betsy Hotel for sweeping views of Ocean  
4:29,Drive’s iconic Art Deco landscape—this  is a hidden gem for a great photo op!
4:32,"Lunch: Big Pink When hunger strikes,  "
4:37,"head to Big Pink, an iconic retro diner on  Collins Avenue. Known for its generous portions  "
4:42,"and nostalgic diner vibes, Big Pink offers  a mouthwatering selection of comfort foods,  "
4:47,from stacked burgers to fluffy pancakes.  Popular menu items include the chicken and  
4:53,"waffles and the famous Big Pink Burger,  with lunch prices around $20-$30 USD."
4:58,"Afternoon : Miami Beach Botanical Garden After lunch, head to the Miami Beach Botanical  "
5:04,"Garden for a lush escape in the city. This  compact, tropical paradise offers a serene setting  "
5:10,"with native plants, orchids, and water features.  Entry is free, though donations are welcome,  "
5:15,and guided tours are available for a small fee. Insider Tip: Visit the Japanese garden within  
5:21,the park for a quiet spot to relax and take  photos—it’s a hidden gem often missed by visitors.
5:26,"Holocaust Memorial Miami Beach Just a short walk from the garden, visit  "
5:32,the Holocaust Memorial Miami Beach. This moving  tribute to Holocaust victims features a striking  
5:37,"sculpture and tranquil gardens. Entry is free,  making it an accessible experience for everyone."
5:42,Evening: Sunset at South Pointe Pier End your day with a sunset stroll  
5:47,"along South Pointe Pier. This scenic spot  offers stunning views of the Miami skyline,  "
5:52,"Biscayne Bay, and the Atlantic Ocean.  It’s a fantastic place to unwind as  "
5:57,the sun dips below the horizon. Insider  Tip: Arrive early to snag a spot along  
6:03,"the railing for the best view of the sunset,  and keep an eye out for passing cruise ships!"
6:07,"Dinner: Smith & Wollensky For a classic steak dinner with a view,  "
6:13,dine at Smith & Wollensky at the edge of South  Pointe Park. Indulge in prime cuts of steak  
6:19,or fresh seafood while soaking in ocean views.  Dinner here costs around $50-$80 USD per person.
6:24,Insider Tip: Ask for a table on the  patio for uninterrupted views of the  
6:29,sunset and Miami skyline—it’s one of  the most romantic spots in the area.
6:33,Day 2: Dive Into Little Havana and Coconut Grove Breakfast: Chug’s Diner 
6:38,"Start your day at Chug’s Diner in Coconut Grove,  where you’ll enjoy a Cuban-American breakfast with  "
6:44,a twist. Try their famous breakfast sandwich or a  guava pastelito for an authentic Miami experience.  
6:51,Expect to spend around $10-$15 USD per person. Insider Tip: Pair your meal with a Cuban coffee  
6:54,"for a taste of Miami’s Cuban roots,  and if you’re feeling adventurous,  "
6:59,ask for it “con leche evaporada” (with  evaporated milk) for an extra creamy texture.
7:05,Morning : Little Havana Cultural Walking Tour Immerse yourself in Miami’s Cuban culture with  
7:10,"a guided walking tour of Little Havana. Walk  down Calle Ocho, take in vibrant street art,  "
7:14,"and watch a game at Domino Park, where  locals play daily. Tours cost around $25  "
7:19,USD and offer insights into the history  and culture of Miami’s Cuban community. 
7:24,"Insider Tip: Stop by a local shop for  a free sample of Cuban coffee, a bold,  "
7:27,sweet espresso that’s a staple in Little Havana.
7:32,Cuban Cigar Factory Visit Continue your exploration by visiting  
7:37,"a Cuban cigar factory, where you can witness  the skilled artisans hand-rolling cigars. This  "
7:42,"is a unique part of Little Havana’s heritage,  and many shops offer demonstrations for free. "
7:47,"Insider Tip: Even if you don’t smoke, pick  up a cigar as a souvenir—some shops carry  "
7:52,cigars with unique flavors like coffee or  honey that are great conversation starters.
7:55,Lunch: El Exquisito 
8:00,"Enjoy a hearty lunch at El Exquisito, a  beloved Cuban restaurant with a welcoming,  "
8:04,"family-run vibe. Try their ropa  vieja (shredded beef) or picadillo,  "
8:10,both traditional Cuban dishes packed with  flavor. Lunch costs about $15-$20 USD per person. 
8:17,Insider Tip: Order a side of yuca fries or maduros  (sweet plantains) for a truly authentic meal!
8:22,Afternoon : Vizcaya Museum and Gardens Head over to the Vizcaya Museum and Gardens in  
8:28,"Coconut Grove, a magnificent historic estate with  stunning European-inspired gardens and beautiful  "
8:33,"architecture. Entry costs around $25 USD, and  it’s worth every penny for the chance to explore  "
8:40,the mansion’s elegant rooms and lush gardens. Insider Tip: The Italian-style garden maze  
8:44,near the main fountain is a fun spot  for photos and a little adventure.
8:48,Coconut Grove Village Spend your late afternoon exploring Coconut Grove  
8:53,"Village, a quaint and lively neighborhood known  for its outdoor cafes, boutiques, and waterfront  "
8:59,"parks. Stroll through the shaded streets, shop for  local artisan goods, and enjoy the relaxed vibe. "
9:04,"Insider Tip: Don’t miss the Barnacle Historic  State Park, an old house on the water with  "
9:08,"beautiful views of Biscayne Bay, just  a few minutes away from the main strip."
9:13,"Evening: Happy Hour at Monty’s Raw Bar For sunset views and a casual evening vibe,  "
9:18,head to Monty’s Raw Bar in Coconut Grove. This  waterfront spot has a popular happy hour with  
9:25,"fresh oysters, shrimp, and tropical cocktails. Insider Tip: Arrive early to snag a seat near  "
9:29,"the water, as this spot fills  up fast, especially on weekends."
9:32,Dinner: Ariete Finish the day  
9:37,"with dinner at Ariete, a chic Coconut Grove  restaurant offering inventive dishes with  "
9:41,Cuban and American influences. Try the  venison tartare or the local catch of  
9:47,the day for a unique dining experience. Dinner  prices here are around $50-$70 USD per person.
9:52,Insider Tip: Ariete’s dessert  menu is fantastic—don’t leave  
9:56,"without trying their homemade flan,  which is one of the best in Miami."
10:02,Day 3: Wynwood and Downtown Miami Art and Culture Breakfast: The Salty Donut 
10:06,Start your day with a stop at The Salty  Donut in Wynwood for artisanal donuts  
10:12,"and coffee. Their flavors are creative and change  seasonally, like maple bacon or guava and cheese,  "
10:17,making each visit unique. A coffee and  donut combo costs around $8-$12 USD. 
10:23,"Insider Tip: The line can get long, so arrive  early or order ahead online to avoid the wait."
10:26,"Morning : Wynwood Walls Explore Wynwood Walls,  "
10:31,an outdoor museum showcasing Miami’s vibrant  street art and murals. Wander through this  
10:34,"colorful maze of artwork created  by world-renowned graffiti artists,  "
10:39,with each mural telling a different  story. Entry costs about $12 USD.
10:43,"Museum of Graffiti Just a short walk from Wynwood Walls,  "
10:48,the Museum of Graffiti is another can’t-miss for  art lovers. It’s the first museum in the world  
10:52,"dedicated to the evolution of graffiti, featuring  interactive exhibits and a fascinating collection  "
10:59,of artwork. Admission is around $16 USD. Insider Tip: Check their schedule for rotating  
11:04,exhibits—this museum frequently features new  installations from global graffiti icons.
11:09,"Lunch: 1-800-Lucky For lunch, head to 1-800-Lucky,  "
11:15,an Asian food hall in Wynwood offering everything  from ramen to sushi and dim sum. You can sample a  
11:20,"range of flavors, with lunch prices around  $15-$25 USD depending on your choices. "
11:25,Insider Tip: Try Taiyaki’s Japanese  soft-serve ice cream for dessert—it’s  
11:28,served in a fish-shaped cone  and makes for a fun photo!
11:35,Afternoon : Pérez Art Museum Miami (PAMM) Make your way to Pérez Art Museum Miami (PAMM) in  
11:40,downtown Miami for a stunning blend of modern  and contemporary art. The waterfront museum  
11:44,offers breathtaking views of Biscayne Bay and  an impressive collection of artworks from around  
11:50,"the world. Admission is about $16 USD, and the  museum’s architecture alone is worth the visit."
11:56,"Phillip and Patricia Frost Museum of Science Just next door, the Phillip and Patricia Frost  "
12:01,Museum of Science is a perfect stop to round  out the day. This interactive science museum  
12:06,"has a planetarium, aquarium, and immersive  exhibits perfect for curious travelers.  "
12:11,"Admission is around $30 USD, and it’s a great  family-friendly option for travelers with kids. "
12:16,Insider Tip: Time your visit to  catch a planetarium show—this  
12:20,museum is known for its spectacular  visuals and educational programming.
12:24,"Evening: Bayside Marketplace For a relaxed evening, head to  "
12:29,"Bayside Marketplace along Biscayne Bay. This  bustling outdoor mall offers waterfront views,  "
12:35,"live music, and a mix of shops and restaurants. Insider Tip: Check the schedule for free live  "
12:40,"performances, and grab a drink at one of  the outdoor bars to enjoy the ambiance."
12:44,Dinner: Casablanca on the Bay Finish your day with a seafood  
12:49,"dinner at Casablanca on the Bay, located right on  the water. This spot is known for its fresh catch,  "
12:57,"including stone crabs, oysters, and fish tacos.  Dinner prices are around $40-$60 USD per person. "
13:03,Insider Tip: Request a table outside for beautiful  evening views of the marina and Miami skyline.
13:07,Thanks for joining me on this epic Miami  adventure! I hope this guide helps you make  
13:12,the most of every moment in this incredible  city. Don’t forget to share your favorite  
13:16,spots in the comments—I’d love to hear about  your Miami experience! And if you’re planning  
13:21,"a trip to the Big Apple next, check out my  New York City itinerary in the next video  "
13:26,for all the must-see spots and insider  tips to make your NYC trip unforgettable.  
English (United States),"Hit that subscribe button so you don’t  miss it, and I’ll see you in New York!"
